{
  "$schema": "https://ui.kitn.ai/schemas/construct/v1.json",
  "name": "support-widget",
  "layout": "widget",
  "provider": {
    "mode": "mock"
  },
  "header": {
    "title": "Support"
  },
  "theme": {
    "mode": "system"
  },
  "empty": {
    "title": "Hi, we're here to help",
    "description": "Ask us about orders, refunds, and more."
  },
  "home": {
    "greeting": {
      "title": "How can we help? 👋",
      "subtitle": "Orders, refunds, anything."
    },
    "recentConversation": true,
    "links": [
      {
        "label": "Help center",
        "href": "https://ui.kitn.ai",
        "description": "Guides and FAQs",
        "icon": "book-open"
      }
    ]
  },
  "widget": {
    "position": "bottom-end"
  },
  "capabilities": {
    "starters": [
      "Where's my order?",
      "Request a refund"
    ],
    "attachments": {
      "accept": [
        "image/*",
        "application/pdf"
      ]
    },
    "history": {
      "persistence": "local"
    },
    "conversations": true,
    "reasoning": "full",
    "messageActions": {
      "user": [
        "edit"
      ],
      "assistant": [
        "copy",
        "like",
        "dislike"
      ]
    }
  }
}
